,address_geocoded,displayLongitude,displayLatitude,address
5422,"проспект Ленина 81, Балашиха, Россия, 143900",37.97784,55.80083,г. Балашиха (Московская обл) проспект Ленина 81
5423,"улица Добролюбова 13, Пушкинский район, Россия, 141254",37.84956,56.04861,"Пушкино Московская область, Пушкинский городской округ улица Добролюбова 13"
5424,"Гвардейская улица 28, Нижний Тагил, Россия, 622005",60.01152,57.94404,"г Нижний Тагил (Свердловская обл, улица Гвардейская 28"
5425,"улица Максимова 33, Казань, Россия, 420127",49.08667,55.86113,"г. Казань (Республика Татарстан), улица Максимова, д. 33"
5426,"улица Катанова 11, Абакан, Россия, 655012",91.4712,53.72286,"г. Абакан (Республика Хакасия), улица Катанова, д. 11"
5427,"улица Победы 22, Белогорск, Россия, 676850",128.46652,50.91912,"г. Белогорск (Амурская область), улица Победы, д.  22"
5428,"улица Карла Маркса 35, Чебоксары, Россия, 428032",47.24903,56.13828,"г. Чебоксары (Чувашская Республика), улица Карла Маркса, д. 35"
5429,"Садовая улица 7, Подольск, Россия, 142106",37.54394,55.45109,"г Подольск (Россия, Московская обл) Садовая 7"
5430,"Амурская улица 19, Москва, Россия, 107241",37.78829,55.81353,г. Москва Амурская улица дом 19
5431,"Московская улица 15, Маловишерский район, Россия, 174260",32.22191,58.84266,г. Малая Вишера (Новгородская обл) Московская 15
5432,"улица Геологов 15, Солнечный район, Россия, 682711",136.63906,50.72618,"посёлок городского типа Солнечный (Хабаровский край), улица Геологов, д. 15"
5433,"Октябрьская улица 91, Железноводск, Россия, 357415",43.00205,44.15032,"г. Железноводск (Ставропольский край), Октябрьская улица, д. 93"
5434,"улица Богдана Хмельницкого 114, Омск, Россия, 644001",73.40977,54.98411,"Омская область, городской округ Омск ул. Б.Хмельницкого д.114/42 к.2/1"
5435,"улица Карпинского 52, Пенза, Россия, 440011",44.97701,53.20794,Пенза (Пензенская обл) Карпинского 52
5436,"улица Революции 51, Александровский район, Россия",38.72531,56.40093,"г. Александров (Владимирская область), улица Революции, д. 51"
5437,"Олимпийский микрорайон 7, Саянск, Россия, 666304",102.1769,54.10979,"г. Саянск (Иркутская область), Олимпийский микрорайон, д. 7"
5438,"улица Сафонова 23, Североморск, Россия, 184606",33.41456,69.07837,"Североморск Мурманская область, городской округ Североморск улица Сафонова 23"
5439,"улица Дзержинского 158, Ставрополь, Россия, 355004",41.95506,45.04238,"г. Ставрополь (Ставропольский край), улица Дзержинского, д. 158"
5440,"Большая Черёмушкинская улица 26 корп 3, Москва, Россия, 117218",37.58568,55.68085,"г. Москва, м Академическая, Большая Черёмушкинская улица, д. 26к3"
5441,"Советская улица 92, Спасск-Дальний, Россия",132.81616,44.59558,"г. Спасск-Дальний (Приморский край), ул. Советская, 92"
5442,"проспект Ленина 136, Кемерово, Россия, 650023",86.15988,55.34896,"г. Кемерово (Кемеровская обл.), пр-кт. Ленина, 136"
5443,"улица Авиаторов 41, Красноярск, Россия, 660077",92.91086,56.04825,"г. Красноярск (Красноярский край), ул. Авиаторов, 41"
5444,"улица Дзержинского 18А, Апатиты, Россия, 184209",33.38502,67.56447,"г Апатиты (Мурманская область), улица Дзержинского 18А"
5445,"улица Народного Ополчения 20 корп 1, Москва, Россия, 123154",37.48051,55.77759,"г. Москва, улица Народного Ополчения, д. 20к1"
5446,"проспект Братьев Коростелевых 111, Оренбург, Россия, 460004",55.06369,51.79905,"г Оренбург (Оренбургская область), проспект Братьев Коростелевых 111"
5447,"проспект Петра Первого 49Е, Махачкала, Россия, 367018",47.54965,42.9626,"г. Махачкала (Республика Дагестан), проспект Петра 1, д. 49Е"
5448,"Железобетонный переулок 4А, Чита, Россия, 672014",113.4613,52.07492,"г Чита (Забайкальский край), Железобетонный переулок 4А"
5449,"Ростовская улица 104, Абинский район, Россия, 353320",38.17796,44.85471,"г Абинск (Краснодарский край), Ростовская улица 106"
5450,"Ленинградская улица 65, Петропавловск-Камчатский, Россия, 683003",158.65762,53.03853,"г. Петропавловск-Камчатский (Камчатский край), Ленинградская улица, д. 65"
5451,"улица Вампилова 34, Иркутск, Россия, 664058",104.23139,52.25332,"г Иркутск (Иркутская обл), Вампилова 34 "
5452,"Ялуторовская улица 14, Тюмень, Россия, 625000",65.53306,57.14978,"г. Тюмень (Тюменская область), Ялуторовская улица, д. 14"
5453,"улица Энтузиастов 8, Волгодонск, Россия, 347360",42.2037,47.51288,г. Волгодонск (Ростовская обл) Энтузиастов 8
5454,"Покровская улица 16, Москва, Россия, 111674",37.93468,55.70038,г. Москва Покровская 16
5455,"улица Калинина 117, Хабаровск, Россия, 680028",135.05241,48.48174,"г. Хабаровск (Хабаровский край), ул. Калинина, д. 117"
5456,"Городская улица 26, Москва, Россия, 108841",37.3124,55.49218,г. Троицк (г Москва) Городская 26
5457,"Ленинский проспект 84 корп 2, Санкт-Петербург, Россия, 198332",30.19893,59.85887,"г. Санкт-Петербург, Ленинский проспект, д. 84к2"
5458,"улица Ленина 64, Киров, Россия, 610004",49.68115,58.608,"г. Киров (Кировская область), улица Ленина, 64"
5459,"Октябрьская улица 57, Калининград, Россия, 236006",20.52004,54.7002,"г Калининград (Калининградская область), Октябрьская 57"
5460,"Вольская улица 81, Самара, Россия, 443008",50.24437,53.21937,"г. Самара (Самарская область), Вольская улица, д. 81"
5461,"Морская улица 45, Краснодар, Россия, 350020",38.96815,45.05526,"г Краснодар (Краснодарский край), Морская 45"
5462,"Загородная улица 16, Осташковский район, Россия",33.13099,57.13985,"г. Осташков (Тверская область), Загородная улица, д. 16"
5463,"Почтовая улица 50Б, Белгород, Россия, 308013",36.67448,50.5834,"г Белгород (Белгородская обл), Почтовая 50Б  "
5464,"Шагольская улица 41, Челябинск, Россия, 454015",61.29863,55.23494,"г. Челябинск (Челябинская область), Шагольская улица, д.41"
5465,"Приморский бульвар 6, Корсаковский район, Россия, 694020",142.771,46.61861,"г. Корсаков (Сахалинская область), Приморский бульвар, д. 6"
5466,"проспект Победы 11, Улан-Удэ, Россия, 670000",107.59285,51.82741,"г. Улан-Удэ (Республика Бурятия), проспект Победы, д. 11"
5467,"улица Амет-Хан Султана 35, Жуковский, Россия, 140185",38.14035,55.58172,"г. Жуковский (Московская область), улица Амет-Хан Султана, д. 35"
5468,"улица Мориса Тореза 67, Новокузнецк, Россия, 654059",87.16782,53.82625,г Новокузнецк (Кемеровская область) улица Тореза 67
5469,"улица Победы 13, Ашинский район, Россия, 456010",57.25463,54.98815,"Аша Челябинская область, Ашинский район улица 40 летия Победы 13"
5470,"улица Ленина 161Б, Верхний Уфалей, Россия, 456804",60.22388,56.05195,"г. Верхний Уфалей (Челябинская область), улица Ленина, д. 161Б"
5471,"Минская улица 16А, Пенза, Россия, 440047",44.94101,53.23314,г. Пенза Минская улица 16А
5472,"улица Гоголя 3, Стерлитамак, Россия, 453130",55.95238,53.61017,"г. Стерлитамак (Республика Башкортостан), улица Гоголя, д. 3"
5473,"проспект 25-го Октября 75, Гатчинский район, Россия, 188300",30.13977,59.57945,"г. Гатчина (Ленинградская обл.), пр-кт 25 Октября, 75"
5474,"Гранитный тупик 2, Долгопрудный, Россия, 141702",37.48755,55.94457,"г. Долгопрудный (Московская область), Гранитный тупик, д. 2"
5475,"улица Ленина 14, Павловский район, Россия",39.78261,46.13364,"г. станица Павловская (Краснодарский край), улица Ленина, д. 14"
5476,"улица Островитянова 43, Москва, Россия, 117342",37.53789,55.63336,"г. Москва, м Коньково, улица Островитянова, д. 43"
5477,"улица Муравленко 28, Муравленко, Россия",74.50096,63.79968,"г. Муравленко (Ямало-Ненецкий автономный округ), улица Муравленко, д. 28"
5478,"улица Машиностроителей 63, Йошкар-Ола, Россия, 424003",47.86738,56.63762,"г. Йошкар-Ола (Республика Марий Эл), улица Машиностроителей, д 63"
5479,"проспект Чекистов 1, Краснодар, Россия, 350089",38.90435,45.02729,"г. Краснодар (Краснодарский край), проспект Чекистов, д. 1"
5480,"улица Воровского 21, Казань, Россия, 420039",49.07925,55.84063,"г. Казань (Республика Татарстан), улица Воровского, д. 21"
5481,"улица Гагарина 96, Саранск, Россия, 430027",45.1532517,54.1759797,"г. Саранск (Республика Мордовия), улица Гагарина, д. 96"
5482,"улица Ленина 117, Георгиевск, Россия, 357820",43.47486,44.15151,"г. Георгиевск (Ставропольский край), ул. Ленина, 117"
5483,"улица Маяковского 7, Тюмень, Россия, 625005",65.53185,57.17496,"г. Сургут (Тюменская область), улица Маяковского, д. 7"
5484,"улица Ленина 172А, Сочи, Россия, 354000",39.90894,43.44241,"г. Сочи (Краснодарский край), улица Ленина, д. 172А"
5485,"Ленинский проспект 79 корп 3, Москва, Россия, 119261",37.54457,55.68498,Москва Ленинский проспект 79к3
5486,"улица Ленина 174, Динской район, Россия",38.9773568,45.2382754,"г. станица Новотитаровская (Краснодарский край), улица Ленина, д. 174"
5487,"Бакунинская улица 43, Москва, Россия, 105082",37.6872211,55.7769901,"г. Москва, Бакунинская улица, д. 43/55"
5488,"улица Карла Маркса 27, Ленинский район, Россия, 404609",45.00396,48.70558,"г. Ленинск (Волгоградская область), улица Карла Маркса, д. 59"
5489,"улица Юлиуса Фучика 1, Екатеринбург, Россия, 620130",60.61511,56.79821,"г. Екатеринбург (Свердловская область), улица Юлиуса Фучика, д. 1"
5490,"улица Васи Алексеева 26, Санкт-Петербург, Россия, 198188",30.27527,59.87725,г. Санкт-Петербург Васи Алексеева 26
5491,"проспект Победы 26, Курск, Россия, 305021",36.1737,51.7797,"г. Курск (Курская область), проспект Победы, д. 26"
5492,"улица Карла Маркса 14, Вологда, Россия, 160019",39.90445,59.23161,"г. Вологда (Вологодская область), улица Карла Маркса, д. 14/44"
5493,"Камвольная улица 3, Краснодар, Россия, 350018",39.06603,45.02642,"г. Краснодар (Краснодарский край), Камвольная улица, д. 3"
5494,"улица Дегтярёва 48, Челябинск, Россия, 454047",61.39641,55.2648,"г. Челябинск (Челябинская область), улица Дегтярёва, д. 48"
5495,"Заводская улица 4, Пучежский район, Россия, 155362",43.16954,56.97216,г. Пучеж (Ивановская обл) Заводская 4
5496,"улица Маршала Гречко 76, Крымский район, Россия, 353380",37.99899,44.92318,"г. Крымск (Краснодарский край), улица Маршала Гречко, д. 76А"
5497,"Центральная улица 37, Бабынинский район, Россия, 249201",36.04402,54.46896,"поселок Воротынск (Калужская область), Центральная улица, д. 38"
5498,"улица Твардовского 23 корп 3, Москва, Россия, 123458",37.40484,55.79582,г Москва (Россия) Твардовского улица 23к3
5499,"Нюйская улица 66, Ленский Улус, Россия, 678144",114.92496,60.72162,"г. Ленск (Республика Саха (Якутия)), Нюйская улица, д. 16"
5500,"улица Павла Корчагина 11, Москва, Россия, 129626",37.65945,55.81717,"г Москва, улица Павла Корчагина, 11"
5501,"улица Ленина 34, Апшеронский район, Россия, 352690",39.74472,44.46053,г. Апшеронск (Краснодарский край) улица Ленина 34
5502,"Воронцовский бульвар 11 корп 1, Всеволожский район, Россия, 188662",30.42088,60.05809,"посёлок Бугры (Ленинградская область), Воронцовский бульвар, д. 11к1"
5503,"Гвардейская улица 8, Тверь, Россия, 170008",35.93404,56.84382,"г. Тверь (Тверская область), Гвардейская улица, д. 8"
5504,"Колхозная улица 12 корп 3, Балашиха, Россия, 143987",38.02178,55.74441,"г. Балашиха мкр Железнодорожный (Московская область), Колхозная улица, д. 12к3"
5505,"улица Ладо Кецховели 95, Красноярск, Россия, 660028",92.81197,56.02397,"г. Красноярск (Красноярский край), ул. Ладо Кецховели, 95"
5506,"Заречная улица 1, Заводоуковск, Россия, 627140",66.54628,56.5061,"г. Мегион (Тюменская область), Заречная улица, д. 1/3"
5507,"улица Козлова 15, Лузский район, Россия, 613980",47.26949,60.6261,"г.Луза (Кировская область), улица Козлова, д.15"
5508,"Невская улица 11А, Волгоград, Россия, 400087",44.5081,48.7173,"г. Волгоград (Волгоградская область), Невская улица, 11А"
5509,"улица Максима Горького 12, Добринский район, Россия, 399431",40.4728152,52.1648083,"посёлок Добринка (Липецкая область), улица Максима Горького, д. 12"
5510,"Ростовская улица 4, Брянск, Россия, 241035",34.31072,53.30601,"г. Брянск (Брянская обл), Ростовская, 4"
5511,"улица Победы 31, Талдомский район, Россия, 141901",37.53413,56.73766,"г. Талдом (Московская область), улица Победы, д. 31"
5512,"улица Академика Сахарова 47, Екатеринбург, Россия, 620016",60.51852,56.78322,"г. Екатеринбург (Свердловская область), проспект Академика Сахарова, д. 47"
5513,"Славянский проспект 6, Рязань, Россия, 390035",39.73503,54.60474,г. Рязань (Рязанская обл) Славянский 6
5514,"проспект Ленина 36, Орск, Россия, 462420",58.47364,51.2331,"г. Орск (Оренбургская область), проспект Ленина, д. 36"
5515,"улица Мира 1, Данковский район, Россия, 399850",39.1478496,53.2467602,"г. Данков (Липецкая область), улица Мира, д. 1"
5516,"улица Степанченко 5, Мирный, Россия, 164170",40.3282495,62.7674313,"г. Мирный (Архангельская область), улица Степанченко, д. 5"
5517,"проспект Горняков 21, Сибай, Россия",58.66807,52.7202,"г. Сибай (Республика Башкортостан), проспект Горняков, д. 21А"
5518,"улица Пушкина 145, Арзамас, Россия, 607220",43.83209,55.3956,"г. Арзамас (Нижегородская область), улица Пушкина, д. 145"
5519,"Английская улица 2, Всеволожский район, Россия, 188691",30.51957,59.90401,д. Кудрово (Ленинградская обл) ул. Английская 2
5520,"улица Шевченко 36, Оренбург, Россия, 460048",55.14567,51.79588,"г Оренбург (Оренбургская обл), Шевченко 36  "
5521,"Дагестанская улица 14, Уфа, Россия, 450014",55.83601,54.71267,"г. Уфа (Республика Башкортостан), Дагестанская улица, д. 14/1"
5522,"Крымская улица 19 корп 1, Ленинский район, Россия, 142718",37.61486,55.52919,Боброво (Московская область) Крымская улица 19к1
5523,"улица Минигали Губайдуллина 19/3, Уфа, Россия, 450022",55.99414,54.72132,"г. Уфа (Республика Башкортостан), улица Минигали Губайдуллина, д. 19/3"
5524,"улица Мира 17, Волоколамский район, Россия, 143613",36.00613,56.13909,"г. Фрязино (Московская область), Мира улица, д. 17"
5525,"улица Ровио 19, Петрозаводск, Россия, 185026",34.36201,61.76175,"г. Петрозаводск (Республика Карелия), улица Ровио, д. 19"
5526,"улица Шогенова 6, Нальчик, Россия, 360032",43.64328,43.4811,г Нальчик Кабардино-Балкарская Республика ул Шогенова 6 А
5527,"улица Мира 70, Йошкар-Ола, Россия, 424005",47.93485,56.63809,"г. Йошкар-Ола (Республика Марий Эл), улица Мира, д. 70"
5528,"8-й квартал 6, Харабалинский район, Россия, 416010",47.2514,47.41326,"г. Харабали (Астраханская область ), 8-й квартал, д. 6"
5529,"Цимлянский переулок 1Б, Новочеркасск, Россия, 346400",40.05063,47.42447,"г. Новочеркасск (Ростовская область), Цимлянский переулок, д. 1Б"
5530,"проспект Мусы Джалиля 74, Набережные Челны, Россия, 423824",52.31096,55.69323,"г. Набережные Челны (Республика Татарстан), проспект Мусы Джалиля, д. 74"
5531,"Красноармейское шоссе 13А, Вяземский район, Россия, 215111",34.30838,55.20065,"г. Вязьма (Смоленская область), Красноармейское шоссе, д. 13А"
5532,"улица Белоглазова 131, Альметьевский район, Россия, 423450",52.2897,54.90251,г. Альметьевск (Республика Татарстан) улица Белоглазова д. 131
5533,"улица Ленина 4/11, Донской, Россия, 301790",38.39312,54.03003,г. Донской (Тульская обл) Ленина 4\11
5534,"Лесная улица 17А, Дзержинский, Россия, 140090",37.86467,55.63045,"г. Дзержинский (Московская область), Лесная улица, д. 17А"
5535,"Аскизская улица 152В, Абакан, Россия, 655009",91.40918,53.69602,"г. Абакан (Республика Хакасия), Аскизская улица, д. 152В"
5536,"улица Исполатова 1, Усманский район, Россия, 399370",39.73013,52.0482,"г. Усмань (Липецкая область), улица Исполатова, д. 1"
5537,"улица Ленина 151А, Северский район, Россия, 353230",38.56438,44.84083,"станица Северская (Краснодарский край), улица Ленина, д. 151А"
5538,"улица Шумакова 16, Барнаул, Россия, 656067",83.67612,53.34175,"г. Барнаул (Алтайский край), ул. Шумакова, 16"
5539,"улица Дружбы 73, Тюмень, Россия, 625031",65.56026,57.1847,"г. Тюмень (Тюменская область), улица Дружбы, д. 73"
5540,"Красноармейская улица 32, Торжок, Россия",34.96845,57.03338,"г. Торжок (Тверская область), Красноармейская улица, д. 32"
5541,"улица Хользунова 72А, Воронеж, Россия, 394053",39.16586,51.70302,г. Воронеж (Воронежская обл) Хользунова 72А
5542,"улица Веденяпина 8, Нижний Новгород, Россия, 603016",43.87014,56.23504,"Нижний Новгород Нижегородская область, городской округ Нижний Новгород улица Веденяпина 8"
5543,"Трактовая улица 16, Тюменский район, Россия, 625520",65.88207,56.8939,"посёлок городского типа Богандинский (Тюменская область), Трактовая улица, д. 16"
5544,"улица Белинского 85, Нижний Новгород, Россия, 603024",44.02762,56.31882,"г. Нижний Новгород (Нижегородская область), улица Белинского, д. 85"
5545,"улица Ставского 30, Динской район, Россия, 353225",39.41636,45.11917,"станица Васюринская (Краснодарский край), улица Ставского, д. 30"
5546,"улица Пушкина 54, Минеральные Воды, Россия, 357202",43.13017,44.21544,"г. Минеральные Воды (Ставропольский край), улица Пушкина, д. 54"
5547,"улица Бограда 2, Минусинск, Россия, 662602",91.7051,53.70455,"г. Минусинск (Красноярский край), улица Бограда, д. 2"
