,address_geocoded,displayLongitude,displayLatitude,address
3526,"Советская улица 20, Инжавинский район, Россия, 393310",42.4957,52.32015,"посёлок городского типа Инжавино (Тамбовская область), Советская улица, д. 20"
3527,"улица Коммунаров 36, Челябинск, Россия, 454078",61.43158,55.13408,г Челябинск (Челябинская область) улица Коммунаров 36
3528,"Оборонная улица 87, Тула, Россия, 300045",37.63125,54.17656,"г. Тула (Тульская область), ул. Оборонная, 87"
3529,"улица Ленина 17А, Ноябрьск, Россия, 629807",75.4381,63.19635,"г. Ноябрьск (Тюменская область), улица Ленина, д. 17А"
3530,"улица Мельникайте 122, Тюмень, Россия, 625007",65.54947,57.12397,"г. Тюмень (Тюменская область), улица Мельникайте, д. 122"
3531,"улица Горького 58, Тверь, Россия, 170026",35.90659,56.86735,"г. Тверь (Тверская область), улица Горького, д. 58"
3532,"улица Молостовых 1Б, Москва, Россия, 108808",37.83325,55.76474,"г. Москва, м Новогиреево, улица Молостовых, д. 1Б"
3533,"улица Мичурина 2Ж, Красноярск, Россия, 660068",92.95978,56.01461,г Красноярск (Красноярский край) улица Мичурина 2Ж
3534,"Подъёмный переулок 1, Москва, Россия, 109052",37.70996,55.7372,"г. Москва, Подъёмный переулок, д. 1"
3535,"улица Космонавтов 52, Дмитровский район, Россия, 141802",37.54818,56.34129,"г. Дмитров (Московская область), улица Космонавтов, д. 52"
3536,"улица Гидростроителей 61, Краснодар, Россия, 350065",39.08445,45.00353,"г. Краснодар (Краснодарский край), улица Гидростроителей, д. 61"
3537,"Автозаводская улица 1, Москва, Россия, 115280",37.66519,55.71026,"г. Москва, м Автозаводская, улица Мастеркова, д. 1"
3538,"улица Ленина 94, Новоуральск, Россия",60.09115,57.23696,"г. Новоуральск (Свердловская область), улица Ленина, д. 94"
3539,"Цимлянская улица 24, Москва, Россия, 109559",37.76855,55.67003,"г. Москва, м Люблино, Цимлянская улица, д. 24"
3540,"Красноармейская улица 19, Забайкальский район, Россия, 674650",117.32951,49.64438,"пгт Забайкальск (Россия, Забайкальский край, Забайкальский р-н) Красноармейская 19"
3541,"улица Калинина 8, Конаковский район, Россия, 171261",36.28703,56.66936,"г. посёлок городского типа Редкино (Тверская область), улица Калинина, д. 8"
3542,"улица Доблести 26, Санкт-Петербург, Россия, 198328",30.17983,59.85365,г Санкт-Петербург (Россия) улица Доблести 26
3543,"набережная Чёрной Речки 10, Санкт-Петербург, Россия, 197183",30.30064,59.98863,"г. Санкт-Петербург, м Чёрная речка, набережная Чёрной речки, д. 10"
3544,"Молодёжный микрорайон 2, Дзержинский район, Россия, 249855",35.93873,54.68069,"Товарково (Калужская область), мкр.Молодежный 2А"
3545,"Спортивная улица 12, Верхняя Салда, Россия, 624760",60.58425,58.05763,"Верхняя Салда (Свердловская обл), Спортивная улица 12к3"
3546,"Физкультурная улица 4, Лобня, Россия, 141732",37.45026,56.0072,"г. Лобня (Московская обл.), ул. Физкультурная, 4"
3547,"улица Просвещения 13 корп 3, Пушкинский район, Россия, 141207",37.85519,56.02771,"г. Пушкино (Московская область), улица Просвещения, д. 13к3"
3548,"улица Саморы Машела 8, Москва, Россия, 117198",37.50043,55.64806,"г. Москва, м Тропарево, улица Саморы Машела, д. 8"
3549,"Кооперативная улица 12, Володарский район, Россия, 606083",42.99163,56.27762,г Володарск (Нижегородская область) Кооперативная улица 12
3550,"улица Щорса 14, Красноярск, Россия, 660003",92.96742,55.99475,"г. Красноярск (Красноярский край), улица Щорса, д. 14"
3551,"улица 8-го Марта 11, Тобольск, Россия, 626152",68.26722,58.20981,"г. Тобольск (Тюменская область), улица 8 Марта, д. 11"
3552,"улица Калинина 4К, Владивосток, Россия, 690035",131.92324,43.10264,"г. Владивосток (Приморский край), ул. Калинина, 4К"
3553,"Октябрьская улица 45, Кимовский район, Россия, 301720",38.53033,53.97386,"г Кимовск (Тульская область, Кимовский район) Октябрьская улица 45"
3554,"улица Белгородского Полка 62, Белгород, Россия, 308000",36.60366,50.60037,"г. Белгород (Белгородская обл), ул. Белгородского полка, 62"
3555,"Вокзальная улица 8А, Нововоронеж, Россия, 396070",39.22169,51.31125,г. Нововоронеж (Воронежская область) ул. Вокзальная д. 8а
3556,"улица 9-го Мая 24, Чебаркуль, Россия, 456440",60.36536,54.9759,"г. Чебаркуль (Челябинская область), улица 9 Мая, д. 24"
3557,"улица Пушкина 54, Великоустюгский район, Россия, 162393",46.31049,60.77285,"г Великий Устюг Вологодская область, Великоустюгский район улица Пушкина 54"
3558,"улица Карла Маркса 12А, Тихвинский район, Россия, 187555",33.51448,59.64508,"г. Тихвин (Ленинградская область), улица Карла Маркса, д. 12А"
3559,"улица Ленина 180, Анапа, Россия",37.3302478,44.8714823,"г. Анапа (Краснодарский край), улица Ленина, д. 180А"
3560,"Московский проспект 82А, Ярославль, Россия, 150023",39.85773,57.58987,"г. Ярославль (Ярославская область), Московский проспект, д. 82А"
3561,"улица Сущёвский Вал 67, Москва, Россия, 129594",37.62291,55.79317,"г. Москва, м Марьина Роща, улица Сущёвский Вал, д. 67"
3562,"Дмитровское шоссе 124А, Москва, Россия, 127495",37.54882,55.9258,"г. Москва, Дмитровское шоссе, д. 124А"
3563,"улица Пальмиро Тольятти 45, Пятигорск, Россия, 357502",43.02117,44.03771,г. Пятигорск (Ставропольский край) Пальмиро  Тольятти 45 строение 2
3564,"Железнодорожная улица 71, Хабаровск, Россия, 680022",135.07594,48.50922,"г. Хабаровск (Хабаровский край), Железнодорожная улица, д. 71"
3565,"улица Космонавта Комарова 19, Нижний Новгород, Россия, 603076",43.92933,56.28236,"г. Нижний Новгород (Нижегородская область), улица Космонавта Комарова, д. 19"
3566,"улица 20 лет Победы 146, Соликамск, Россия",56.76001,59.64349,"  г Соликамск, (Пермский край) улица 20 лет Победы, д. 146"
3567,"Белкинская улица 2, Обнинск, Россия, 249034",36.60401,55.12247,"г. Обнинск (Калужская область), Белкинская улица, д. 2"
3568,"улица Дзержинского 60, Ижевск, Россия, 426050",53.2518634,56.8836864,"г. Ижевск (Удмуртская Республика), улица Дзержинского, д. 60"
3569,"Первомайская улица 20, Щёлковский район, Россия, 141102",37.97177,55.92085,"г. Щёлково (Московская область), Первомайская улица, стр 20 Б кор 1"
3570,"улица Труда 69, Псков, Россия, 180019",28.35059,57.83859,"г. Псков (Псковская область), улица Труда, д. 69"
3571,"улица 30 лет Октября 14, Ухта, Россия, 169314",53.6962,63.56394,"г. Ухта (Республика Коми), улица 30 лет Октября, д. 14"
3572,"Пролетарская улица 15, Россошанский район, Россия",39.54399,50.19925,"г. Россошь (Воронежская область), Пролетарская улица, д. 15"
3573,"улица 800-летия Москвы 26 корп 1, Москва, Россия, 127237",37.56113,55.87947,"г. Москва, улица 800-летия Москвы, д. 26к1"
3574,"улица Крупской 32, Пермь, Россия, 614060",56.27852,58.01717,"г. Пермь (Пермский край), ул. Крупской, 32"
3575,"проспект Королёва 20, Ростов-на-Дону, Россия, 344113",39.71195,47.29433,"г. Ростов-на-Дону (Ростовская область), проспект Королёва, д. 20"
3576,"Камчатская улица 4 корп 2, Москва, Россия, 107065",37.81124,55.8281,"г. Москва, Камчатская улица, д. 4к2"
3577,"улица Ленина 33, Болховский район, Россия, 303140",36.00521,53.44649,"г. Болхов (Орловская область), улица Ленина, д. 31Б"
3578,"улица Можайского 60 корп 1, Тверь, Россия, 170043",35.9,56.81957,"г. Тверь (Тверская область), улица Можайского, д. 60 к 1"
3579,"улица Филатова 15, Муром, Россия, 602252",42.01105,55.57195,"г. Муром (Владимирская область), улица Филатова, д. 15"
3580,"Железнодорожная улица 31, Белово, Россия",86.31077,54.41067,"г. Белово (Кемеровская область), Железнодорожная улица, д. 31"
3581,"Депутатская улица 63/2, Иркутск, Россия, 664081",104.32756,52.26646,"г. Иркутск (Иркутская область), Депутатская улица, д. 63/2"
3582,"Волгоградский проспект 183 корп 2, Москва, Россия, 109472",37.81154,55.69594,"г. Москва, м Выхино, Волгоградский проспект, д. 183к2"
3583,"Ноябрьская улица 47/1, Оренбург, Россия, 460050",55.10544,51.81341,"г. Оренбург (Оренбургская область), Ноябрьская улица, д. 47/1"
3584,"улица Савченко 38, Ставрополь, Россия, 355040",41.90161,45.0049,"г. Ставрополь (Ставропольский край), улица Савченко, д. 38"
3585,"улица Буровиков 6, Стрежевой, Россия, 636780",77.59529,60.72779,Стрежевой (Томская обл) Буровиков 1
3586,"улица 40 лет Октября 46, Канск, Россия, 663600",95.70989,56.22697,"г. Канск (Красноярский край), улица 40 лет Октября, д. 46"
3587,"Северный микрорайон 26, Канск, Россия, 663614",95.72469,56.21714,"г Канск (Россия, Красноярский край) мкрн. Северный 26"
3588,"улица Гагарина 51, Большой Камень, Россия",132.35985,43.11165,"г. Большой Камень (Приморский край), улица Гагарина, д. 51"
3589,"улица Грабина 8Б, Королёв, Россия, 141071",37.82037,55.92579,г Королев (Московская обл) Грабина 8Б
3590,"Троицкий бульвар 6, Москва, Россия, 142190",37.28914,55.46633,"г. Троицк (Москва), Троицкий бульвар, д. 6"
3591,"улица Ленина 4, Тихорецкий район, Россия, 352117",40.28013,45.67357,"станица Архангельская (Краснодарский край), Ленина улица, д. 4"
3592,"улица Генерала Кузнецова 14 корп 1, Москва, Россия, 109156",37.8585,55.68971,"г. Москва, м Жулебино, ул. Генерала Кузнецова, 14 корп. 1"
3593,"улица Академика Лебедева 21, Санкт-Петербург, Россия, 195009",30.3525491,59.9573712,"г. Санкт-Петербург, улица Академика Лебедева, д. 21Б"
3594,"улица Карла Маркса 24, Воскресенский район, Россия, 140203",38.75949,55.25068,"г. Воскресенск (Московская область), улица Карла Маркса, д. 24"
3595,"проспект Луначарского 56 корп 1, Санкт-Петербург, Россия, 194354",30.33592,60.04265,"г. Санкт-Петербург, м Проспект Просвещения, пр-кт Луначарского, 56к1"
3596,"улица Тазаева 9, Санкт-Петербург, Россия, 196655",30.6157,59.74201,"г. Колпино (Санкт-Петербург), улица Тазаева, д. 9"
3597,"улица Эмилии Алексеевой 8, Барнаул, Россия, 656023",83.73178,53.38036,"Барнаул Алтайский край, Город Барнаул улица Эмилии Алексеевой 10"
3598,"улица Гагарина 145, Липецк, Россия, 398032",39.55573,52.62182,"г Липецк (Липецкая область), улица Гагарина 145"
3599,"Октябрьский бульвар 22, Королёв, Россия, 141077",37.8436787,55.9171252,"г. Королёв (Московская область), Октябрьский бульвар, д. 22"
3600,"Заводская улица 18 корп 2, Красногорский район, Россия, 143405",37.32686,55.80945,"г. Красногорск (Московская область), Заводская улица, д. 18к2"
3601,"14-й микрорайон 3, Нефтеюганск, Россия, 628311",72.62419,61.07677,г Нефтеюганск (Ханты-Мансийский Автономный округ - Югра АО) 14 микрорайон 3
3602,"проспект Максима Горького 36/1, Чебоксары, Россия, 428020",47.17404,56.14968,"г. Чебоксары (Чувашская Республика), проспект Максима Горького, д. 36/1"
3603,"Можайское шоссе 169, Одинцовский район, Россия, 143005",37.30886,55.68814,"г. Одинцово (Московская область), Можайское шоссе, д. 169"
3604,"Власихинская улица 77, Барнаул, Россия, 656058",83.68099,53.32769,"г. Барнаул (Алтайский край), Власихинская улица, д. 77"
3605,"улица Лётчика Бабушкина 31, Москва, Россия, 129281",37.67493,55.87045,г. Москва Летчика Бабушкина 31
3606,"Новороссийское шоссе 9А, Туапсинский район, Россия, 352844",38.69531,44.32204,"Джубга (Краснодарский край), Новороссийское 9А"
3607,"Судогодское шоссе 1, Владимир, Россия, 600023",40.43027,56.11001,"г. Владимир (Владимирская область), Судогодское шоссе, д. 1"
3608,"улица Горького 74, Мостовский район, Россия, 352570",40.79669,44.40685,"поселок городского типа Мостовской (Краснодарский край), улица Горького, д. 74"
3609,"8-я Подлесная улица 46, Ижевск, Россия, 426054",53.18653,56.87253,"г. Ижевск (Удмуртская Республика), 8-я Подлесная улица, д. 48"
3610,"Советская улица 6/14, Лыткарино, Россия, 140080",37.90658,55.58228,"г. Лыткарино (Московская обл.), ул.Советская , д. 6/14"
3611,"Главная улица 22А, Балашиха, Россия, 143989",37.99094,55.74613,"г. Балашиха Мкр Железнодорожный (Московская область), Главная улица, д. 22А"
3612,"Медицинский переулок 23, Красноярск, Россия, 660006",92.84647,55.97364,г Красноярск  Медицинский пер. 23
3613,"улица Мелиораторов 8А, Городецкий район, Россия",43.4799,56.63856,"г Городец (Нижегородская область), улица Мелиораторов 8А"
3614,"улица Чечулина 11 корп 1, Москва, Россия, 108808",37.83063,55.7816,г Москва Чечулина 11к1
3615,"Интернациональная улица 15, Моршанск, Россия, 393950",41.80424,53.44043,"г. Моршанск (Тамбовская область), Интернациональная улица, д. 15"
3616,"Шахматная улица 4Б, Калининград, Россия, 236038",20.55578,54.73489,"г. Калининград (Калининградская область), Шахматная улица, д. 4Б"
3617,"Мичуринская улица 2, Приозерский район, Россия, 188730",30.25336,60.55661,"п Сосново (Ленинградская обл, Приозерский р-н) Мичуринская 2Б"
3618,"Народная улица 15, Минусинск, Россия, 662610",91.67818,53.6947,"г. Минусинск (Красноярский край), Народная улица, д. 15"
3619,"улица Ленина 48Б, Нарьян-Мар, Россия, 166000",52.98145,67.63677,г. Нарьян-Мар (Ненецкий АО) Ленина  48 Б
3620,"улица Героя России Эдуарда Белана 12, Липецк, Россия, 398036",39.51561,52.58009,"г Липецк Россия, Липецкая обл Белана 12"
3621,"площадь Джона Рида 7 корп 1, Астрахань, Россия, 414000",48.04023,46.33676,"г. Астрахань (Астраханская обл.), пл. Джона Рида, 7 корп.1"
3622,"Дмитровское шоссе 38 корп 1, Москва, Россия, 127238",37.5715,55.84074,"г. Москва, м Петровско-Разумовская, Дмитровское шоссе, д. 38к1"
3623,"Пролетарская улица 106, Саранск, Россия, 430016",45.177,54.19055,"г Саранск (Россия, Респ Мордовия) Пролетарская 106"
3624,"Северное шоссе 50, Раменский район, Россия, 140105",38.21832,55.58131,г. Раменское (Московская обл) Северное шоссе 50
3625,"улица А. С. Пушкина 3А корп 1, Элиста, Россия, 358009",44.27174,46.30438,"г. Элиста (Республика Калмыкия), улица Пушкина, д. 3А к. 1"
3626,"Юбилейный микрорайон 23, Саянск, Россия",102.1611,54.10772,"г. Саянск (Иркутская область), Юбилейный микрорайон, д. 23"
3627,"Вокзальная улица 51А, Одинцовский район, Россия, 143005",37.30966,55.68345,"г. Одинцово (Московская область), Вокзальная улица, д. 51А"
3628,"проспект Ленина 4, Северодвинск, Россия, 164501",39.82173,64.56678,г Северодвинск Архангельская обл Ленина 4
3629,"улица Буйнакского 12, Дербент, Россия",48.30244,42.0569,г. Дербент (Респ Дагестан) Ул. Буйнакского 68
3630,"Донецкая улица 30 корп 2, Москва, Россия, 109651",37.70482,55.64611,г. Москва Донецкая 30к2
3631,"Псковская улица 31/1, Великий Новгород, Россия, 173009",31.23223,58.50698,"г. Великий Новгород (Новгородская область), Псковская улица, 31/1"
3632,"Спортивная улица 6, Москва, Россия, 119027",37.3017944,55.6110381,"г. Москва, м. Спортивная, ул. Доватора, 6/6 корп. 8"
3633,"Ессентукская улица 23, Курский район, Россия, 357850",44.45501,44.04185,ст-ца. Курская (Ставропольский край) Ессентукская 23
3634,"Трудовая улица 22, Ивантеевка, Россия, 141281",37.93862,55.96687,г. Ивантеевка (Московская обл) Трудовая  22
3635,"Степная улица 12/1, Балаково, Россия, 413864",47.83151,52.01564,"Балаково Саратовская область, Балаковский район Степная 12/1"
3636,"улица Егорова 12, Дедовичский район, Россия, 182711",29.9727917,57.5250433,"Дедовичи Псковская область, Дедовичский район улица Егорова 14"
3637,"улица Тельмана 41 корп 1, Санкт-Петербург, Россия, 193315",30.48323,59.89217,"г Санкт-Петербург, улица Тельмана 41к1"
3638,"Большая Зеленовская улица 6, Подольск, Россия, 142100",37.54708,55.43681,"г. Подольск (Московская область), Большая Зелёновская улица, д. 6"
3639,"улица Бекетова 10, Салават, Россия, 453265",55.95876,53.34421,"г. Салават (Республика Башкортостан), улица Бекетова, д. 10"
3640,"улица Кубяка 6, Калуга, Россия, 248012",36.2528998,54.5771448,"г. Калуга (Калужская область), улица Кубяка, д. 6"
3641,"улица Ленина 16, Хабаровский район, Россия, 680507",135.2309,48.3544,"село Некрасовка (Хабаровский край), улица Ленина, д. 16"
3642,"2-я Филёвская улица 6, Москва, Россия, 121096",37.4939,55.73586,"г. Москва, 2-я Филёвская улица, д. 6"
3643,"улица Урицкого 11, Армавир, Россия, 352909",41.13973,44.99939,"г Армавир (Краснодарский край), улица Урицкого 11"
3644,"Спортивная улица 10, Берёзовский, Россия",60.82612,56.91281,г Березовский (Свердловская обл) Спортивная 10
3645,"Приморский проспект 52 корп 1, Санкт-Петербург, Россия, 197374",30.23769,59.9836,Санкт-Петербург Приморский пр.  52к.1
3646,"улица Урицкого 58, Орехово-Зуево, Россия, 142605",38.96884,55.8134,"г. Орехово-Зуево (Московская обл.), ул. Урицкого, 58"
3647,"Лосевская улица 22, Москва, Россия, 129347",37.71637,55.8775,г. Москва Лосевская 22
3648,"Радужная улица 14 корп 2, Москва, Россия, 142784",37.3732,55.58975,г. Московский ул.Радужная 14к2
3649,"Поречная улица 21, Москва, Россия, 109469",37.76505,55.64918,г. Москва Поречная улица д. 21
3650,"улица Победы 34, Осинники, Россия",87.33528,53.59594,"г. Осинники (Кемеровская область), улица Победы, д. 34"
3651,"улица Рапова 9, Рыбинск, Россия, 152912",38.81134,58.05678,"г. Рыбинск (Ярославская область), улица Рапова, д. 9"
3652,"Вишнёвая улица 20, Саратов, Россия, 410040",45.97809,51.56448,г Саратов (Саратовская область) Вишнёвая улица 20
3653,"Дмитровское шоссе 74 корп 1, Москва, Россия, 127474",37.55606,55.86046,г. Москва Дмитровское ш.  74к1
