,address_geocoded,displayLongitude,displayLatitude,address
0,"улица Ораза Жандосова 150A, 050035 Алматы, Қазақстан",76.87203,43.21364,"г. Алматы, улица Жандосова, д. 150А"
1,"микрорайон Молодёжный 42, Талдықорған, Қазақстан",78.3587,44.9998,"г. Талдыкорган (Алматинская область), МКР Молодежный, д. 42"
2,"улица Челябинская 6, Қостанай, Қазақстан",63.59941,53.19262,"г. Костанай (Костанайская область), ул. Челябинская, д. 6"
3,"микрорайон Коктем 10A, Көкшетау, Қазақстан",69.3865,53.31354,"г. Кокшетау (Акмолинская область), мкр Коктем , д. 10А"
4,"улица Николая Гоголя 51, Қарағанды, Қазақстан",73.10325,49.80936,"г. Караганда (Карагандинская область), улица Гоголя, д. 51"
5,"проспект Победы 9, Ақтөбе, Қазақстан",57.1434,50.31815,"г. Актобе (Актюбинская область), проспект Победы, д. 11"
6,"улица Кабанбай батыра 120, Өскемен, Қазақстан",82.63871,49.9503,"г. Усть-Каменогорск (Восточно-Казахстанская область), улица Кабанбай батыра, д. 120"
7,"улица Алаша Козбагарова 30, Семей, Қазақстан",80.25832,50.41025,"г. Семей (Семейский р-н.), ул. Казбагарова, 30"
8,"улица Казыбек би 36, Өскемен, Қазақстан",82.60742,49.89841,г Усть-Каменогорск (Восточно-Казахстанская обл) Казыбек Би 42
9,"улица Ильяса Есенберлина 18, 010011 Нұр-Сұлтан, Қазақстан",71.41033,51.19001,"г. Нур-Султан (Астана) (город республиканского значения Нур-Султан), улица Илияса Есенберлина, д. 18"
10,"улица Мамай батыра 99, Семей, Қазақстан",80.2398396,50.4241625,г Семей (Восточно-Казахстанская область) улица Мамай батыра 99
11,"улица Карталинская 3A, 010003 Нұр-Сұлтан, Қазақстан",71.38801,51.19881,г Нур-Султан (город республиканского значения Нур-Султан) Карталинская улица 3а
12,"Мақажанов көшесі 15, Ақсу, Қазақстан",76.78742,52.26015,"Ленинский, (Павлодарская область), улица Макажанова 14А"
13,"микрорайон Думан-2 25, 050064 Алматы, Қазақстан",77.00307,43.28556,г. Алматы микр Думан 2 25
14,"улица Толе Би 33, Алакөл ауданы, Қазақстан",80.9236577,46.1735901,с. Шардара (Алматинская обл) Толе би 4В
15,"улица Садыка Мухамеджанова 9, 050016 Алматы, Қазақстан",76.95423,43.26914,г. Алматы (Алматы) улица Мухамеджанова 9
16,"улица Валентина Катаева 95, Павлодар, Қазақстан",76.97584,52.26256,г Павлодар (Павлодарская область) улица Катаева 95
17,"улица Дмитрия Карбышева 22, Өскемен, Қазақстан",82.58215,49.96005,"г. Усть-Каменогорск (Восточно-Казахстанская область), улица Карбышева, д. 22"
18,"проспект Строителей 31, Қарағанды, Қазақстан",73.13664,49.77705,"г. Караганда (Карагандинская область), проспект Строителей, д. 31"
19,"микрорайон Нурсая 18, Атырау, Қазақстан",51.86495,47.1176,"г. Атырау (Атырауская область), Микрорайон Нурсая, д. 18"
20,"улица Казахстан 85, Өскемен, Қазақстан",82.63297,49.95566,"г. Усть-Каменогорск (Восточно-Казахстанская область), улица Казахстан, д. 85"
21,"улица Мухтара Ауэзова 77, Екібастұз, Қазақстан",75.30826,51.72473,"г. Экибастуз (Павлодарская область), улица Ауэзова, д. 77"
22,"Қобыланды батыр көшесі 2, Ақтөбе, Қазақстан",57.26951,50.20342,"Актобе (Актюбинская обл), Батыс 2 9 "
23,"улица Кобыланды батыра 10, Қостанай, Қазақстан",63.6665,53.2348,"г.Костанай (Костанайская область), проспект Кобланды батыра, д. 10"
24,"улица Сабита Донентаева 36, Ақсу, Қазақстан",76.9161,52.04097,г. Аксу (Павлодарская обл) Донентаева 36
25,"улица Самен батыра 37A, 040700 Іле ауданы, Қазақстан",77.02491,43.41763,с Отеген батыр (Алматинская область) Самен Батыр 37А
26,"микрорайон 5В 19, Жітіқара ауданы, Қазақстан",61.18524,52.19219,"г. Житикара (Костанайская область), 5А микрорайон, д. 20А"
27,"улица Динмухамеда Конаева 1, Панфилов ауданы, Қазақстан",80.0019774,44.1896261,"г. Жаркент (Алматинская область), улица Кунаева, д. 218/1"
28,"улица Николая Гоголя 36, Қызылжар ауданы, Қазақстан",69.153,54.86247,Петропавловск (Северо-Казахстанская обл) улица Гоголя 36/А
29,"улица Евгения Брусиловского 5, 010005 Нұр-Сұлтан, Қазақстан",71.45533,51.16133,"г. Нур-Султан (Астана) (город республиканского значения Нур-Султан), улица Евгения Брусиловского, д. 5"
30,"Кондюрин көшесі 36, Зайсан ауданы, Қазақстан",84.8688733,47.4753593,"г. Зайсан (Восточно-Казахстанская область), Кондюрин к?шесi, д. 4/1"
31,"улица Набережная 35, Ақсу, Қазақстан",76.86795,52.14776,"г Аксу (Павлодарская область), Набережная улица 35"
32,"микрорайон 29 20, Ақтау, Қазақстан",51.16932,43.67154,г. Актау 29 микрорайон 20
33,"микрорайон 11 13, Ақтөбе, Қазақстан",57.19514,50.28667,г. Актобе (Актюбинская область) 11 мкр д. 13
34,"проспект Бухар-Жырау 46/1, Қарағанды, Қазақстан",73.08698,49.8054,"г. Караганда (Карагандинская обл.), пр-кт. Бухар Жырау, 46 /1"
35,"улица Сергея Кирова 55, 021700 Бурабай ауданы, Қазақстан",70.27326,52.95506,"г Щучинск Акмолинская область, Бурабайский район улица Кирова 55"
36,"улица Шокана Уалиханова 35B, Ақтөбе, Қазақстан",57.2196,50.28042,"г Актобе ( Актюбинская обл), улица Шокана Уалиханова 35Б "
37,"микрорайон 1 7, 111200 Лисаковск, Қазақстан",62.50195,52.54477,"г. Лисаковск (Костанайская область), 1 микрорайон, д. 7"
38,"улица Мира 227, Қызылжар ауданы, Қазақстан",69.1477,54.90177,"г. Петропавловск (Северо-Казахстанская область), улица Мира, д. 229"
39,"проспект Азаттык 101, Атырау, Қазақстан",51.91811,47.09186,Атырау (Казахстан) ул Азаттык д 101
40,"улица Сергея Кирова 71, Өскемен, Қазақстан",82.62461,49.95419,"г. Усть-Каменогорск (Восточно-Казахстанская обл.), ул. Кирова, 71"
41,"улица Заводская 70, Ақтөбе, Қазақстан",57.23144,50.27282,"г. Актобе (Актюбинская область), Заводская улица, д. 72"
42,"Бозтаева көшесі 4, Семей, Қазақстан",80.22235,50.38924,"г. Семей (Восточно-Казахстанская область), улица Бозтаева, д. 4 "
43,"проспект Независимости 12, Риддер, Қазақстан",83.50736,50.33987,"г. Усть-Каменогорск (Восточно-Казахстанская обл.), пр-кт. Независимости, 12"
44,"улица Казыбек Би 120, Жамбыл ауданы, Қазақстан",71.37752,42.89822,г. Тараз (Жамбылская область) улица Казыбек би 120
45,"улица Исы Байзакова 263, 050008 Алматы, Қазақстан",76.91186,43.24638,"г. Алматы, ул. Байзакова, 263"
46,"улица Абылай Хана 233, Қарасай ауданы, Қазақстан",76.61802,43.20333,г. Каскелен (Алматинская обл) Аблай-хана  233
47,"улица Сабатаева 80, Көкшетау, Қазақстан",69.37677,53.27885,г Кокшетау (Акмолинская область) улица Сабатаева 82
48,"улица Братьев Жубановых 274, Ақтөбе, Қазақстан",57.14918,50.29235,Актобе  улица Братьев Жубановых 274
49,"улица Есет батыра 100, Ақтөбе, Қазақстан",57.1548,50.30711,"г. Актобе (Актюбинская область), ул. Есет Батыра , д.100"
50,"улица Мангельдина 35B, Шымкент, Қазақстан",69.57382,42.32195,"г. Шымкент (Южно-Казахстанская область) ул .Мангельдина  д, 35Б"
51,"улица Абая 40, 071100 Май ауданы, Қазақстан",78.55763,50.74419,"г. Курчатов (Восточно-Казахстанская область), улица Абая, д. 40"
52,"микрорайон Аксай-1 10, 050031 Алматы, Қазақстан",76.83475,43.24216,"г. Алматы, мкр. Аксай 1, д. 10/3"
53,"улица Бегим Ана 6, Қызылорда, Қазақстан",65.49619,44.85194,г. Кызылорда (Кызылординская область) улица Бегим ана 6
54,"улица Желтоксан 47, Қызылорда, Қазақстан",65.50357,44.83683,"г. Кызылорда (Кызылординская область), улица Желтоксан, д. 47"
55,"улица Толстого 107, Павлодар, Қазақстан",76.96715,52.27375,"г. Павлодар (Павлодарский р-н.), ул. Толстого, 107 /1Б"
56,"улица Дмитрия Крылова 80, Өскемен, Қазақстан",82.61101,49.94766,"г. Усть-Каменогорск (Восточно-Казахстанская область), улица Крылова, д. 80"
57,"проспект Независимости 18, Риддер, Қазақстан",83.50499,50.33789,"г. Риддер (Восточно-Казахстанская область), проспект Независимости, д. 18"
58,"улица Сергея Тюленина 8, Орал, Қазақстан",51.40642,51.23897,"г. Уральск (Западно-Казахстанская область), улица Сергея Тюленина, д. 6А"
59,"микрорайон 1 40, 021500 Степногорск, Қазақстан",71.88002,52.34156,"Степногорск (Акмолинская обл), 1 мкр 40"
60,"проспект Богенбай батыра 56, 010000 Нұр-Сұлтан, Қазақстан",71.42822,51.17707,"г. Нур-Султан (Астана) (город республиканского значения Нур-Султан), проспект Богенбай батыра, д. 56"
61,"улица Абдрахман акына 31, Қаратал ауданы, Қазақстан",77.9850126,45.2568609,г. Уштобе (Алматинская обл) Абдрахман Акына  38 кв 31
62,"микрорайон 5 27, Қапшағай, Қазақстан",77.05026,43.84798,"г Капчагай (Казахстан, Алматинская обл, Капчагайский р-н) микрорайон 5 27"
63,"улица Сергея Прокофьева 140, 050005 Алматы, Қазақстан",76.87604,43.24258,"г. Алматы, улица Прокофьева, д. 140"
64,"Алтын Адам аллея 119A, Еңбекшіқазақ ауданы, Қазақстан",77.437208,43.3656888,г. Есик (Алматинская обл) Алтын Адам Аллеясы 119А
65,"микрорайон Мамыр-4 297A, 050036 Алматы, Қазақстан",76.85028,43.21504,"г. Алматы, Мамыр 4 микрорайон, д. 297А"
66,"улица Малика Габдуллина 36A, Көкшетау, Қазақстан",69.39535,53.2914,"г. Кокшетау (Акмолинская обл.), ул. Габдуллина, 36а"
67,"улица Толе Би 212, Алакөл ауданы, Қазақстан",80.9434511,46.1613767,"г. Ушарал (Алматинская область), улица Толе би, д. 215"
68,"улица Братьев Жубановых 298, Ақтөбе, Қазақстан",57.16041,50.28386,"г. Актобе (Актюбинская область), улица Братьев Жубановых, д. 298"
69,"Зыряновск тұйық көшесі 16, Алтай ауданы, Қазақстан",84.27813,49.72477,"г. Зыряновск (Восточно-Казахстанская область), улица Ленина, д. 88"
70,"улица Султана Баймагамбетова 183, Қостанай, Қазақстан",63.62631,53.21403,"г. Костанай (Костанайская область), улица Баймагамбетова, д. 183"
71,"улица Владимира Ленина 189, Рудный, Қазақстан",63.10039,52.96156,"г. Рудный (Костанайская область), улица Ленина, д. 189"
72,"микрорайон 2 32, Ақтау, Қазақстан",51.16994,43.64104,"г. Актау (Мангистауская область), Микрорайон 2, д. 32"
73,"Айнабұлақ көшесі 2, 050058 Алматы, Қазақстан",76.87942,43.29075,"Алматы, Айнабулак 32/2"
74,"улица Бокенбай Батыра 131V, Ақтөбе, Қазақстан",57.1995578,50.2610614,Актобе (Актюбинская область) улица Бокенбай Батыра 131В
75,"улица Кумбел 1, 010001 Нұр-Сұлтан, Қазақстан",71.43104,51.13745,"Нур-Султан город республиканского значения Нур-Султан улица, Кумбел 3/1"
76,"улица Кабдырахмана Ерниязова 18, Атырау, Қазақстан",51.89768,47.10758,"г. Атырау (Атырауская область), улица Ерниязова, д. 18"
77,"микрорайон Самал 33, Жаңаөзен, Қазақстан",52.85756,43.33935,"г. Жанаозен (Мангистауская область), микрорайон Самал, д. 33"
78,"проспект Магжана Жумабаева 6, 010008 Нұр-Сұлтан, Қазақстан",71.47961,51.15522,"г. Нур-Султан (Астана) (город республиканского значения Нур-Султан), проспект Магжана Жумабаева, д. 6"
79,"улица Тауельсиздык 102, Сарқант ауданы, Қазақстан",79.91986,45.40775,"г Сарканд (Казахстан, Алматинская обл) Тауелсиздык 102"
80,"микрорайон 4-й 33, Бөрлі ауданы, Қазақстан",53.0225351,51.1607232,"г Уральск, 4-й микрорайон (Западно-Казахстанская область) д 33"
81,"проспект Абылхайыр Хана 76, Ақтөбе, Қазақстан",57.17238,50.28738,"г. Актобе (Актюбинская обл.), пр-кт. Абылхайыр хана, 76"
82,"улица Рысбек батыра 4, Жамбыл ауданы, Қазақстан",71.34501,42.90386,"г. Тараз (Жамбылская область), улица Рысбек батыра, д. 4"
83,"улица Женис 99, Қызылорда, Қазақстан",65.52453,44.82504,"г. Кызылорда (Кызылординская область), улица Женис, д. 99"
84,"улица Ахмета Байтурсынова 14, Хромтау ауданы, Қазақстан",58.4311054,50.2516703,"г. Алга (Актюбинская область), улица Байтурсынова, д. 14"
85,"улица Константина Циолковского 11, 021700 Бурабай ауданы, Қазақстан",70.17952,52.9227,"Щучинск (Акмолинская обл), улица Циолковского 11"
86,"микрорайон Юбилейный 44A, Көкшетау, Қазақстан",69.42488,53.27017,"г Кокшетау, микрорайон Юбилейный (Акмолинская область, городской акимат Кокшетау) 44а"
87,"проспект Шакарима 135, Семей, Қазақстан",80.26522,50.42316,г Семей Семей проспект Шакарима 163
88,"микрорайон 12 20, Ақтау, Қазақстан",51.14905,43.65683,"г Актау Мангистауская область, городской акимат Актау 12 микрорайон 20"
89,"улица Александра Пушкина 17, Жезқазған, Қазақстан",67.70893,47.78985,"г Жезказган (Карагандинская область), улица Пушкина 17"
90,"улица Бауыржана Момышулы 21, Шемонаиха ауданы, Қазақстан",81.9108659,50.6278449,"г. Шемонаиха (Восточно-Казахстанская область), улица Момышулы, д. 21"
91,"улица Молодёжная 1, Алтай ауданы, Қазақстан",84.26207,49.71714,г. Алтай ул. Молодёжная д. 1.
92,"Әлия Молдағұлова көшесі 29, Шымкент, Қазақстан",69.56895,42.30538,Шымкент (Шымкент) Алия Молдагулова 29
93,"улица Александра Пушкина 60, 050010 Алматы, Қазақстан",76.95419,43.25311,"г. Алматы, улица Пушкина, д. 60"
94,"улица Таира Жарокова 217, 050060 Алматы, Қазақстан",76.9011,43.22393,"г. Алматы, улица Жарокова, д. 217"
95,"улица Пратова 36, 160800 Сайрам ауданы, Қазақстан",69.8277874,42.4226175,"Аксукент (Туркестанская область), улица Пратова 36"
96,"улица Абая Кунанбайулы 132, 020800 Ерейментау ауданы, Қазақстан",73.10432,51.62038,"г Ерейментау (Акмолинская область, Ерейментауский район) улица Абая Кунанбаева 132"
97,"проспект Туран 9, 010000 Нұр-Сұлтан, Қазақстан",71.41156,51.15059,г Нур-Султан проспект Туран 9
98,"улица Амангельды Иманова 91, Ақтөбе, Қазақстан",57.21193,50.27325,"г Актобе (Актюбинская область), улица Амангельды Иманова 91"
99,"улица Юрия Гагарина 36/4, Орал, Қазақстан",51.447,51.23323,"г. Уральск (Западно-Казахстанская область), улица Гагарина, д. 36/4"
100,"улица Бауыржана Момышулы 7, 041100 Кербұлақ ауданы, Қазақстан",77.9661969,44.3537997,Сарыозек (Алматинская область) Б. Момышулы 2 б
101,"улица Ивана Панфилова 27, 160400 Кентау, Қазақстан",68.5127,43.51272,"г. Кентау (Туркестанская область), улица Панфилова, д. 27"
102,"улица Шокана Уалиханова 154G, Көкшетау, Қазақстан",69.40294,53.27543,"г. Кокшетау (Акмолинская область), улица Валиханова, д. 154 Г"
103,"улица Кенесары Хана 45, 010000 Нұр-Сұлтан, Қазақстан",71.42945,51.16611,г Нур-Султан улица Кенесары 45
104,"микрорайон 8 109, Теміртау, Қазақстан",72.9456862,50.0455205,"г.Темиртау (Карагандинская область), 8 мкр, д. 109"
105,"улица Феликса Дзержинского 7, Қостанай, Қазақстан",63.61083,53.22442,"г. Костанай (Костанайская область), улица Дзержинского, д. 7"
106,"проспект Юрия Гагарина 286, 050060 Алматы, Қазақстан",76.89953,43.20493,"г. Алматы, проспект Гагарина, д. 287/1"
107,"микрорайон Нурсат 237, Шымкент, Қазақстан",69.63234,42.35779,г. Шымкент (Южно-Казахстанская область) мкр. Нурсат-1 д. 237
108,"улица Би-Боранбая 39, Семей, Қазақстан",80.21525,50.40295,"г Семей (Восточно-Казахстанская обл), улица Би Боранбая 39"
109,"улица Ломова 37, Павлодар, Қазақстан",76.95402,52.26286,"г. Павлодар (Павлодарская область), улица Ломова, д. 37/1"
110,"улица Таира Жарокова 16, 050009 Алматы, Қазақстан",76.89896,43.24713,"г. Алматы, улица Жарокова, д. 16"
111,"улица Толе Би 299, 161100 Төле Би ауданы, Қазақстан",69.9029851,42.1787423,Ленгер Толе би 298
112,"Құрманғазы көшесі 163, Орал, Қазақстан",51.37407,51.21478,"г. Уральск (Западно-Казахстанская область), улица Курмангазы, д. 163"
113,"улица Абая 17, Атырау, Қазақстан",51.93204,47.10346,г. Атырау (Атырауская обл)  ул Абая  д 17
114,"улица Альмукана Сембинова 7, 010000 Нұр-Сұлтан, Қазақстан",71.44857,51.16839,"г. Нур-Султан (Астана), ул. Сембинова , д. 7 в.п.7"
115,"улица Абая Кунанбайулы 72, Семей, Қазақстан",80.25187,50.4016,"г Семей (Восточно-Казахстанская обл), улица Абая Кунанбаева 72"
116,"улица Шамшы Калдаякова 8, Шымкент, Қазақстан",69.54301,42.32939,"г Шымкент (Южно-Казахстанская обл), улица Калдаякова 8"
117,"улица Кенена Азирбаева 47, 010010 Нұр-Сұлтан, Қазақстан",71.50402,51.12882,г Нур-Султан (Казахстан) улица Кенена Азербаева 47
118,"улица Естая 150, Павлодар, Қазақстан",76.97787,52.28673,"г Павлодар (Павлодарская область), улица Естая 150"
119,"микрорайон 7 15/1, 021500 Степногорск, Қазақстан",71.89431,52.35783,"г. Степногорск (Акмолинская область), Микрорайон 7, д. 15/1"
120,"улица Абылай Хана 45A, 021700 Бурабай ауданы, Қазақстан",70.20745,52.93912,"г. Щучинск (Акмолинская область), улица Абылай хана, д. 45А"
121,"улица Турара Рыскулова 288, Талғар ауданы, Қазақстан",77.25599,43.33308,г. Талгар (Алматинская обл) Рыскулова  288
122,"улица Мира 218, Қызылжар ауданы, Қазақстан",69.14413,54.88392,"г. Петропавловск (Северо-Казахстанская область), улица Мира, д. 218"
123,"улица Анаркулова 4, Жезқазған, Қазақстан",67.70836,47.80563,"г. Жезказган (Карагандинская область), улица Анаркулова, д. 4"
124,"проспект Металлургов 27, Теміртау, Қазақстан",72.96755,50.05327,"г. Темиртау (Карагандинская область), проспект Металлургов, д. 27"
125,"микрорайон Аса 16, Жамбыл ауданы, Қазақстан",71.3267079,42.8852035,"г. Тараз (Жамбылская область), Аса микрорайон, д. 16"
126,"улица Есет батыра 158, Ақтөбе, Қазақстан",57.16628,50.29453,"г Актобе (Актюбинская область, городской акимат Актобе) улица Есет Батыра 158"
