,address_geocoded,displayLongitude,displayLatitude,address
1762,"улица Крупской 28, Псков, Россия, 180021",28.35893,57.82818,"г. Псков (Псковская область), улица Крупской, д. 28"
1763,"улица Рыленкова 57, Смоленск, Россия, 214036",32.10395,54.75908,"г. Смоленск (Смоленская область), улица Рыленкова, д. 57"
1764,"улица Лавочкина 13 корп 1, Химки, Россия, 141407",37.42157,55.89166,"г. Химки (Московская область), улица Лавочкина, д. 13к1"
1765,"улица Титова 38, Екатеринбург, Россия, 620085",60.61066,56.77666,"г. Екатеринбург (Свердловская обл.), ул. Титова, 38"
1766,"Яхромская улица 3, Москва, Россия, 127411",37.53886,55.88353,"г. Москва, Яхромская улица, д. 3"
1767,"Севастопольский проспект 1 корп 3, Москва, Россия, 117152",37.6122,55.6936,"г. Москва, Севастопольский проспект, д. 1к3"
1768,"Ласточкин проезд 4, Балашиха, Россия, 143921",38.07603,55.75431,"г. Балашиха мкр Заря (Московская область), Ласточкин проезд, вл. 8"
1769,"улица Собины 4, Алексеевский район, Россия, 309850",38.67606,50.6196,"г. Алексеевка (Белгородская область), улица В. Собины, д. 4"
1770,"Комсомольский проспект 69, Амурск, Россия",136.91927,50.24415,"г. Амурск (Хабаровский край), Комсомольский проспект, д. 69"
1771,"проспект Победы 21, Вологда, Россия, 160000",39.88538,59.22147,"г. Вологда (Вологодская область), проспект Победы, д. 21"
1772,"6-й квартал 36, Шелехов, Россия, 666034",104.09324,52.20872,"г. Шелехов (Иркутская область), 6-й квартал, д. 36"
1773,"Октябрьская улица 33, Балашиха, Россия, 143980",37.99793,55.75131,"г. Балашиха (Московская область), Октябрьская улица, д. 33"
1774,"улица Володарского 55, Лодейнопольский район, Россия, 187700",33.54815,60.73081,"г. Лодейное Поле (Ленинградская область), ул. Володарского, д. 55"
1775,"Кольцевая улица 14, Лобня, Россия, 141730",37.48667,56.00503,"г. Лобня (Московская область), Кольцевая улица, д. 14"
1776,"Вокзальная улица 14, Пушкинский район, Россия, 141207",37.81386,55.98911,"г Пушкино (Московская область), Вокзальная улица 14"
1777,"улица Рокоссовского 40А, Псков, Россия, 180025",28.26949,57.81634,"г. Псков (Псковская область), улица Рокоссовского, д. 40А"
1778,"Ленинский переулок 40, Сосновоборский район, Россия, 442570",46.25152,53.28909,"г Сосновоборск (Пензенская область), Ленинский переулок 40"
1779,"проспект Шолохова 9, Ростов-на-Дону, Россия, 344019",39.74727,47.23876,"г. Ростов-на-Дону (Ростовская область), проспект Шолохова, д. 9"
1780,"улица Бориса Полевого 9, Тверь, Россия, 170004",35.84093,56.84496,Тверь (Тверская область) улица Бориса Полевого 9
1781,"Астраханская улица 7, Тамбов, Россия, 392002",41.46666,52.70478,"г. Тамбов (Тамбовская область), Астраханская улица, 7/1"
1782,"улица Гагарина 15, Рыбинск, Россия, 152919",38.8495562,58.0344154,"г Рыбинск (Россия, Ярославская обл, Рыбинский р-н), Гагарина, д. 15"
1783,"улица Бойчука 7, Северодвинск, Россия, 164501",39.82012,64.56173,"г. Северодвинск (Архангельская область), улица Бойчука, д 7/5"
1784,"12-я линия 7, Балашиха, Россия, 143914",37.89859,55.77404,"г. Балашиха (Московская область), улица 12-я Линия, д. 7А"
1785,"улица 3-й Пятилетки 4, Новодвинск, Россия, 164900",40.81694,64.41402,"г. Новодвинск (Архангельская область), улица 3-й Пятилетки, д. 4"
1786,"улица Софьи Перовской 103 корп 25, Астрахань, Россия, 414000",48.07835,46.34688,"г. Астрахань (Астраханская область), улица Софьи Перовской, д. 103к25"
1787,"Можайское шоссе 80Б, Одинцовский район, Россия, 143005",37.29858,55.68395,"г. Одинцово (Московская область), Можайское шоссе, д. 80Б"
1788,"Рабочая улица 92, Новоаннинский район, Россия",42.67376,50.53396,"г. Новоаннинский (Волгоградская область), Рабочая улица, д. 92"
1789,"улица Новосёлов 6, Исетский район, Россия, 626395",65.65737,56.65295,"г. Ноябрьск (Тюменская область), улица Новосёлов, д. 6А"
1790,"Линейная улица 53/1, Новосибирск, Россия, 630105",82.92749,55.0535,г. Новосибирск (Новосибирская обл) Линейная 53/1
1791,"переулок Романа Гилёва 15 корп 1, Бийск, Россия, 659300",85.22476,52.54127,"г. Бийск (Алтайский край), переулок Романа Гилева, д. 15/1"
1792,"улица Академика Легостаева 4, Королёв, Россия, 141068",37.8623,55.90527,"г. Королёв (Московская область), улица Академика Легостаева, д. 4"
1793,"проспект России 28, Кирово-Чепецк, Россия",50.04371,58.54698,г Кирово-Чепецк (Кировская область) проспект Россия 28
1794,"улица Баки Урманче 5, Казань, Россия, 420064",49.17718,55.73209,"г Казань (Россия, Респ Татарстан) Баки Урманче 5"
1795,"Свободная улица 16А, Тамбов, Россия, 392027",41.39261,52.77227,"г. Тамбов (Тамбовская область), Свободная улица, д. 16А"
1796,"Керамическая улица 29, Балашиха, Россия, 143983",37.97212,55.75019,г. Балашиха (Московская обл) Керамическая  29
1797,"улица Николаева 12, Новосибирск, Россия, 630090",83.11199,54.85778,"г. Новосибирск (Новосибирская область), улица Николаева, д. 12/3"
1798,"2-й Фабричный проезд 16, Пушкинский район, Россия, 141205",37.8639,56.00438,г Пушкино (Московская область) 2-й Фабричный проезд 16
1799,"Озёрная улица 9, Люберецкий район, Россия, 140000",37.95612,55.70046,г Люберцы (Московская область)Озёрная улица 9
1800,"улица Худайбердина 71, Стерлитамак, Россия, 453126",55.94973,53.62339,"г. Стерлитамак (Республика Башкортостан), улица Худайбердина, д. 71"
1801,"проспект Ямашева 49, Казань, Россия, 420124",49.12157,55.82576,"г. Казань (Республика Татарстан), проспект Ямашева, д. 49"
1802,"Кленовый бульвар 26, Москва, Россия, 115470",37.67788,55.67716,"г. Москва, м Коломенская, Кленовый бульвар, д. 26"
1803,"Нижняя улица 73, Воронеж, Россия, 394033",39.23695,51.65046," г Воронеж (Воронежская область), Нижняя улица 73"
1804,"Большой проспект В.О. 32, Санкт-Петербург, Россия, 199162",30.27767,59.93712,"г Санкт-Петербург, Большой проспект В.О 32/12"
1805,"улица Ленина 231, Земетчинский район, Россия, 442000",42.60937,53.48979,"Рп. Земетчино (Пензенская обл, Земетчинский район), ул. Ленина, д. 231/1"
1806,"Лыжный переулок 3, Санкт-Петербург, Россия, 197374",30.2029,59.99692,г Санкт-Петербург (Россия) Лыжный переулок 3
1807,"проспект Мира 11, Орск, Россия, 462403",58.50388,51.22845,"г. Орск (Оренбургская область), проспект Мира, д. 11"
1808,"улица Генерала Белова 29, Москва, Россия, 115563",37.72133,55.615,Москва (Россия) Генерала Белова 29
1809,"проспект Ленина 18, Сургут, Россия, 628403",73.40593,61.24725,"г. Сургут (Ханты-Мансийский Автономный округ - Югра АО), проспект Ленина, 18"
1810,"Пристанская улица 7, Ханты-Мансийск, Россия, 628001",69.04768,60.96695,"г. Ханты-Мансийск (Тюменская область), Пристанская улица, д. 7"
1811,"Административная улица 4, Ногинский район, Россия, 142460",38.33563,55.72316,"п Воровского (Россия, Московская обл, Ногинский р-н) Административная улица 5"
1812,"улица Демонстрации 27 корп 1, Тула, Россия, 300034",37.58407,54.18996,"г. Тула (Тульская область), улица Демонстрации, д. 27к1"
1813,"4-я линия Васильевского Острова 11, Санкт-Петербург, Россия, 199004",30.28426,59.9416,г. Санкт-Петербург 11-я линия Васильевского Острова 60
1814,"Юбилейная улица 77Б, Северский район, Россия",38.49249,44.84988,пгт. Черноморский (Краснодарский край) Юбилейная 77Б
1815,"Красноармейская улица 115, Йошкар-Ола, Россия, 424019",47.8513943,56.6425871,"г. Йошкар-Ола (Республика Марий Эл), Красноармейская улица, д. 115"
1816,"Оснабрюкская улица 10, Тверь, Россия, 170027",35.86153,56.82428,"г. Тверь (Тверская область), Оснабрюкская улица, д. 10"
1817,"Советская улица 20, Мантурово, Россия",44.77434,58.33654,"г. Мантурово (Костромская область), Советская улица, д. 21"
1818,"Речная улица 59, Магадан, Россия",150.78965,59.59009,Магадан Речная 59
1819,"улица Толбухина 7 корп 1, Москва, Россия, 121596",37.40087,55.7202,"г. Москва, улица Толбухина, д. 7к1"
1820,"Гольяновская улица 7 корп 1, Москва, Россия, 105094",37.70962,55.77551,г. Москва Гольяновская 7 к1
1821,"Советская улица 7, Мирнинский Улус, Россия, 678174",113.9794,62.54353,"г. Мирный (Республика Саха (Якутия), ул. Советская улица, д. 7А"
1822,"Десантная улица 14, Раменский район, Россия, 140104",38.20858,55.56931,"г Раменское Россия, Московская обл, Раменский р-н Десантная 14"
1823,"улица Энтузиастов 20, Сосновоборск, Россия, 662500",93.33945,56.12492,"Сосновоборск Красноярский край, городской округ Сосновоборск улица Энтузиастов 20а"
1824,"улица Рабочий Городок 10, Воскресенский район, Россия, 140343",38.64514,55.49357,"р.п. Цюрупы (Московская обл, Воскресенский р-н) Рабочий городок 10 -А"
1825,"улица Шигаева 19, Ульяновск, Россия, 432066",48.27581,54.26768,"г. Ульяновск (Ульяновская область), улица Шигаева, д. 19Б"
1826,"улица Свердлова 79, Тетюшский район, Россия, 422370",48.84091,54.93295,г. Тетюши (Респ Татарстан) ул. Свердлова 79
1827,"проспект Мира 90 корп 1, Чебоксары, Россия, 428024",47.26454,56.10914,"г. Чебоксары (Чувашская Республика), проспект Мира, д. 90к1"
1828,"5-й микрорайон 4, Красноармейск, Россия, 412804",45.70256,51.012,"г Красноармейск (Россия, Саратовская обл) 5 микрорайон 4"
1829,"Липовая аллея 15, Санкт-Петербург, Россия, 197183",30.2566302,59.986843,г Санкт-Петербург (Санкт-Петербург) Липовая аллея 15
1830,"площадь Ленина 63, Клепиковский район, Россия, 391030",40.17356,55.13016,"Спас-Клепики (Рязанская обл), площадь Ленина 66"
1831,"проспект Энгельса 98, Санкт-Петербург, Россия, 194214",30.3179,60.02611,г. Санкт-Петербург проспект Энгельса д. 98
1832,"улица Луначарского 76, Екатеринбург, Россия, 620075",60.61734,56.84713,г Екатеринбург (Свердловская область) улица Луначарского 76
1833,"улица Галиуллина 26, Магнитогорск, Россия, 455034",58.96999,53.36986,"г. Магнитогорск (Челябинская область), улица Галиуллина, д. 26"
1834,"улица Руднева 47, Хабаровск, Россия, 680018",135.04259,48.56592,г Хабаровск (Хабаровский край) ул. Руднева 47
1835,"улица Братьев Кашириных 89, Челябинск, Россия, 454021",61.36716,55.17813,"г. Челябинск (Челябинская область), улица Братьев Кашириных, д. 89"
1836,"проезд Моторостроителей 4, Ярославль, Россия, 150064",39.76593,57.70342,"г. Ярославль (Ярославская область), проезд Моторостроителей, 4"
1837,"улица Орджоникидзе 2Г, Батайск, Россия, 346887",39.73876,47.12775,"г Батайск (Россия, Ростовская обл) Орджоникидзе 2г"
1838,"улица Ленина 119, Аургазинский район, Россия, 453480",55.8876,54.01108,"Толбазы Республика Башкортостан, Аургазинский район улица Ленина 119"
1839,"улица Мира 9, Трёхгорный, Россия",58.4472,54.81436,"г. Трёхгорный (Челябинская область), улица Мира, д. 9"
1840,"улица Генерала Чоглокова 5, Всеволожский район, Россия, 188680",30.64052,59.9364,"Старая (Ленинградская область), улица Генерала Чоглокова 5"
1841,"бульвар Маршала Рокоссовского 6 корп 1В, Москва, Россия, 107370",37.72759,55.81096,"г Москва, бульвар Маршала Рокоссовского 6к1В"
1842,"улица Добролюбова 31, Ростовский район, Россия",39.38673,57.18025,г Ростов (Ярославская область) Добролюбова 31
1843,"Боровское шоссе 27, Москва, Россия, 119633",37.36568,55.64479,г. Москва Боровское шоссе д. 27
1844,"Ленинградское шоссе 94 корп 1, Москва, Россия, 125565",37.47051,55.85578,"г. Москва, м Речной вокзал, Ленинградское шоссе, д. 94к1"
1845,"улица Аристарха Макарова 58, Кинешма, Россия",42.21317,57.43617,"г. Кинешма (Ивановская область), улица Аристарха Макарова, д. 58"
1846,"улица Ленина 146, Шпаковский район, Россия, 356240",42.01928,45.13367,"г. Михайловск (Ставропольский край), улица Ленина, д. 146/1"
1847,"Симферопольская улица 4, Москва, Россия, 108851",37.57261,55.50799,"г Москва, Симферопольская улица 4А"
1848,"улица Кирова 40, Сокольский район, Россия, 162130",40.12038,59.45882,"г. Сокол (Вологодская область), улица Кирова, д. 40"
1849,"улица Ломоносова 19, Выгоничский район, Россия, 243361",34.0604861,53.1011911,Выгоничи (Брянская область) улица Ломоносова 19
1850,"Богородский микрорайон 10 корп 2, Щёлковский район, Россия, 141107",37.97782,55.93972,"г. Щёлково (Московская область), Богородский микрорайон, д. 10к2"
1851,"Инициативная улица 54А, Таганрог, Россия, 347936",38.91259,47.26251,г Таганрог (Ростовская область) Инициативная улица 54А
1852,"Каширское шоссе 95Б, Домодедово, Россия, 142004",37.77462,55.42573,"г. Домодедово (Московская область), Каширское шоссе, д. 95Б"
1853,"Евсеевская улица 4, Стародуб, Россия, 243240",32.76217,52.58299,г. Стародуб (Брянская обл) Евсеевская 4
1854,"улица Родионова 25, Нижний Новгород, Россия, 603093",44.05775,56.3154,"г Нижний Новгород (Нижегородская область), улица Родионова 25 "
1855,"Коммунистическая улица 4, Вяземский район, Россия, 682950",134.75297,47.53555,"г. Вяземский (Хабаровский край), Коммунистическая улица, д. 4"
1856,"3-й Павловский переулок 14, Москва, Россия, 115093",37.63023,55.71835,"г. Москва, м Тульская, 3-й Павловский переулок, д. 14"
1857,"Большая Садовая улица 139/150, Саратов, Россия, 410054",45.98258,51.53447,г Саратов (Саратовская область) Большая Садовая улица 139/150
1858,"улица Бориса Галушкина 15, Москва, Россия, 129301",37.6579,55.82402,"г. Москва, м ВДНХ, улица Бориса Галушкина, д. 15"
1859,"улица Алабяна 12 корп 1, Москва, Россия, 125080",37.50124,55.79886,г Москва (Россия) Алабяна 12к1
1860,"Анадырский проезд 69, Москва, Россия, 129336",37.71008,55.88246,"г. Москва, Анадырский проезд, д. 69"
1861,"улица Введенского 13Б, Москва, Россия, 117342",37.54198,55.64218,г Москва  улица Введенского 13Б
1862,"проспект Победы 22, Чайковский, Россия, 617762",54.14369,56.76345,Чайковский Пермский край проспект Победы 22
1863,"3-я Фрунзенская улица 10, Москва, Россия, 119146",37.57901,55.72145,"г. Москва, м Фрунзенская, 3-я Фрунзенская улица, д. 10"
1864,"Восточное шоссе 22, Балашиха, Россия, 143900",38.0464708,55.7878575,"г Балашиха (Россия, Московская обл), Восточное шоссе, д. 22"
1865,"Октябрьская улица 23, Кузоватовский район, Россия, 433760",47.68785,53.54263,г Кузоватово (Ульяновская область) Октябрьская улица 23
1866,"улица Гоголя 43, Ставрополь, Россия, 355007",41.97499,45.05955,г Севастополь (Россия) Гоголя 43
1867,"Петрозаводская улица 34, Москва, Россия, 125475",37.48905,55.86761,"г. Москва, Петрозаводская улица, д. 34"
1868,"улица Ленина 23 корп 11, Лобня, Россия, 141730",37.47148,56.00999,"г. Лобня (Московская область), улица Ленина, д. 23к11"
1869,"улица Костычева 72, Брянск, Россия, 241037",34.33171,53.26403,г Брянск (Брянская обл) Костычева 72
1870,"проспект Ленина 121, Тула, Россия, 300026",37.58646,54.15945,г Тула (Тульская область) проспект Ленина 121
1871,"Советская улица 1, Чайковский, Россия, 617762",54.10555,56.76438,"Чайковский (Пермский край, Чайковский городской округ) Советская улица 1"
1872,"улица Герцена 118, Вологда, Россия, 160012",39.90949,59.20249,"Вологда (Вологодская область, городской округ Вологда) Герцена 118"
1873,"улица Калинина 33А, Новочеркасск, Россия, 346400",40.08216,47.48618,"Новочеркасск (Ростовская область, городской округ Новочеркасск) улица Калинина 33А"
1874,"улица Энтузиастов 21, Усть-Илимск, Россия, 666685",102.75788,57.95404,г Усть-Илимск (Иркутская обл) Энтузиастов 21
1875,"Советская улица 154, Урюпинск, Россия, 403116",42.00272,50.81439,"г Урюпинск (Волгоградская область, городской округ Урюпинск) Советская улица 154"
1876,"Советская улица 168, Иркутск, Россия, 664009",104.3317,52.27963,"г. Иркутск (Иркутская область), Советская улица, д. 168"
1877,"Молодогвардейская улица 45, Москва, Россия, 121351",37.41007,55.73334,"г. Москва, Молодогвардейская улица, д. 45"
1878,"улица Шелгунова 9 корп 1, Санкт-Петербург, Россия, 192174",30.45635,59.86675,г. Санкт-Петербург Шелгунова  9 к 1
1879,"улица Лихоборские Бугры 12, Москва, Россия, 125183",37.54741,55.84363,"г. Москва, Лихоборские бугры 12"
1880,"улица Механизаторов 16, Щёлковский район, Россия, 141147",38.4361181,56.1237345,"поселок городского типа Фряново (Московская область), улица Механизаторов, д. 16"
1881,"Большой Саввинский переулок 2 корп 1, Москва, Россия, 119435",37.56994,55.73652,"г. Москва, м Киевская, Большой Саввинский переулок, д. 2к1"
1882,"Десантная улица 17, Раменский район, Россия, 140104",38.19842,55.56692,"г. Раменское (Московская область), Десантная улица, 17"
1883,"улица Павловского 15, Новокузнецк, Россия, 654007",87.13322,53.77042,"г. Новокузнецк (Кемеровская область), улица Павловского, 15"
1884,"Советская улица 8, Спас-Деменский район, Россия",34.04501,54.40914,"Детчино (Калужская обл), улица Советская 8"
1885,"Ташкентская улица 35, Москва, Россия, 109472",37.80308,55.69484,"г. Москва, м Кузьминки, Ташкентская улица, д. 35"
1886,"улица Володарского 7, Саранск, Россия, 430005",45.19031,54.18317,"г. Саранск (Республика Мордовия), улица Володарского, д. 7"
1887,"Молодёжная улица 6 корп 2, Железногорск, Россия, 307179",35.34908,52.35795,г Железногорск (Курская область) Молодёжная улица 6к2
1888,"улица Вилиса Лациса 1, Москва, Россия, 125480",37.43237,55.86482,г. Москва Вилиса Лациса 1
1889,"Россошанская улица 2 стр 1, Москва, Россия, 117535",37.6057,55.59434,Москва Россошанская д2стр1
